22:39:23.479615 IP 134.122.35.219.ssh > bras-base-toroon0560w-grc-34-76-64-134-8.dsl.bell.ca.62923: Flags [P.], seq 1055820:1056024, ack 613, win 501, length 204
22:39:23.479776 IP 134.122.35.219.ssh > bras-base-toroon0560w-grc-34-76-64-134-8.dsl.bell.ca.62923: Flags [P.], seq 1056024:1056228, ack 613, win 501, length 204
22:39:23.479902 IP 134.122.35.219.ssh > bras-base-toroon0560w-grc-34-76-64-134-8.dsl.bell.ca.62923: Flags [P.], seq 1056228:1056432, ack 613, win 501, length 204
22:39:23.480026 IP 134.122.35.219.ssh > bras-base-toroon0560w-grc-34-76-64-134-8.dsl.bell.ca.62923: Flags [P.], seq 1056432:1056636, ack 613, win 501, length 204
22:39:23.480158 IP 134.122.35.219.ssh > bras-base-toroon0560w-grc-34-76-64-134-8.dsl.bell.ca.62923: Flags [P.], seq 1056636:1056840, ack 613, win 501, length 204
22:39:23.480293 IP 134.122.35.219.ssh > bras-base-toroon0560w-grc-34-76-64-134-8.dsl.bell.ca.62923: Flags [P.], seq 1056840:1057044, ack 613, win 501, length 204
22:39:23.480427 IP 134.122.35.219.ssh > bras-base-toroon0560w-grc-34-76-64-134-8.dsl.bell.ca.62923: Flags [P.], seq 1057044:1057248, ack 613, win 501, length 204
22:39:23.480553 IP 134.122.35.219.ssh > bras-base-toroon0560w-grc-34-76-64-134-8.dsl.bell.ca.62923: Flags [P.], seq 1057248:1057452, ack 613, win 501, length 204
22:39:23.480676 IP 134.122.35.219.ssh > bras-base-toroon0560w-grc-34-76-64-134-8.dsl.bell.ca.62923: Flags [P.], seq 1057452:1057656, ack 613, win 501, length 204
22:39:23.480811 IP 134.122.35.219.ssh > bras-base-toroon0560w-grc-34-76-64-134-8.dsl.bell.ca.62923: Flags [P.], seq 1057656:1057860, ack 613, win 501, length 204
22:39:23.480936 IP 134.122.35.219.ssh > bras-base-toroon0560w-grc-34-76-64-134-8.dsl.bell.ca.62923: Flags [P.], seq 1057860:1058064, ack 613, win 501, length 204
22:39:23.481064 IP 134.122.35.219.ssh > bras-base-toroon0560w-grc-34-76-64-134-8.dsl.bell.ca.62923: Flags [P.], seq 1058064:1058268, ack 613, win 501, length 204
22:39:23.481275 IP 134.122.35.219.ssh > bras-base-toroon0560w-grc-34-76-64-134-8.dsl.bell.ca.62923: Flags [P.], seq 1058268:1058472, ack 613, win 501, length 204
22:39:23.481479 IP 134.122.35.219.ssh > bras-base-toroon0560w-grc-34-76-64-134-8.dsl.bell.ca.62923: Flags [P.], seq 1058472:1058676, ack 613, win 501, length 204
22:39:23.481645 IP 134.122.35.219.ssh > bras-base-toroon0560w-grc-34-76-64-134-8.dsl.bell.ca.62923: Flags [P.], seq 1058676:1058880, ack 613, win 501, length 204
22:39:23.481801 IP 134.122.35.219.ssh > bras-base-toroon0560w-grc-34-76-64-134-8.dsl.bell.ca.62923: Flags [P.], seq 1058880:1059084, ack 613, win 501, length 204
22:39:23.481935 IP 134.122.35.219.ssh > bras-base-toroon0560w-grc-34-76-64-134-8.dsl.bell.ca.62923: Flags [P.], seq 1059084:1059288, ack 613, win 501, length 204
22:39:23.482063 IP 134.122.35.219.ssh > bras-base-toroon0560w-grc-34-76-64-134-8.dsl.bell.ca.62923: Flags [P.], seq 1059288:1059492, ack 613, win 501, length 204
22:39:23.482194 IP 134.122.35.219.ssh > bras-base-toroon0560w-grc-34-76-64-134-8.dsl.bell.ca.62923: Flags [P.], seq 1059492:1059696, ack 613, win 501, length 204
22:39:23.482322 IP 134.122.35.219.ssh > bras-base-toroon0560w-grc-34-76-64-134-8.dsl.bell.ca.62923: Flags [P.], seq 1059696:1059900, ack 613, win 501, length 204
22:39:23.482451 IP 134.122.35.219.ssh > bras-base-toroon0560w-grc-34-76-64-134-8.dsl.bell.ca.62923: Flags [P.], seq 1059900:1060104, ack 613, win 501, length 204
22:39:23.482573 IP 134.122.35.219.ssh > bras-base-toroon0560w-grc-34-76-64-134-8.dsl.bell.ca.62923: Flags [P.], seq 1060104:1060308, ack 613, win 501, length 204
22:39:23.482696 IP 134.122.35.219.ssh > bras-base-toroon0560w-grc-34-76-64-134-8.dsl.bell.ca.62923: Flags [P.], seq 1060308:1060512, ack 613, win 501, length 204
22:39:23.482844 IP 134.122.35.219.ssh > bras-base-toroon0560w-grc-34-76-64-134-8.dsl.bell.ca.62923: Flags [P.], seq 1060512:1060716, ack 613, win 501, length 204
22:39:23.482972 IP 134.122.35.219.ssh > bras-base-toroon0560w-grc-34-76-64-134-8.dsl.bell.ca.62923: Flags [P.], seq 1060716:1060920, ack 613, win 501, length 204
22:39:23.483128 IP 134.122.35.219.ssh > bras-base-toroon0560w-grc-34-76-64-134-8.dsl.bell.ca.62923: Flags [P.], seq 1060920:1061124, ack 613, win 501, length 204
22:39:23.483263 IP 134.122.35.219.ssh > bras-base-toroon0560w-grc-34-76-64-134-8.dsl.bell.ca.62923: Flags [P.], seq 1061124:1061328, ack 613, win 501, length 204
22:39:23.483394 IP 134.122.35.219.ssh > bras-base-toroon0560w-grc-34-76-64-134-8.dsl.bell.ca.62923: Flags [P.], seq 1061328:1061532, ack 613, win 501, length 204
22:39:23.483518 IP 134.122.35.219.ssh > bras-base-toroon0560w-grc-34-76-64-134-8.dsl.bell.ca.62923: Flags [P.], seq 1061532:1061736, ack 613, win 501, length 204
22:39:23.483643 IP 134.122.35.219.ssh > bras-base-toroon0560w-grc-34-76-64-134-8.dsl.bell.ca.62923: Flags [P.], seq 1061736:1061940, ack 613, win 501, length 204
22:39:23.483794 IP bras-base-toroon0560w-grc-34-76-64-134-8.dsl.bell.ca.62923 > 134.122.35.219.ssh: Flags [.], ack 1046148, win 1043, length 0
22:39:23.483838 IP 134.122.35.219.ssh > bras-base-toroon0560w-grc-34-76-64-134-8.dsl.bell.ca.62923: Flags [P.], seq 1061940:1062144, ack 613, win 501, length 204
22:39:23.483857 IP bras-base-toroon0560w-grc-34-76-64-134-8.dsl.bell.ca.62923 > 134.122.35.219.ssh: Flags [.], ack 1052964, win 1043, length 0
22:39:23.484037 IP 134.122.35.219.ssh > bras-base-toroon0560w-grc-34-76-64-134-8.dsl.bell.ca.62923: Flags [P.], seq 1062144:1062636, ack 613, win 501, length 492
22:39:23.484166 IP 134.122.35.219.ssh > bras-base-toroon0560w-grc-34-76-64-134-8.dsl.bell.ca.62923: Flags [P.], seq 1062636:1062840, ack 613, win 501, length 204
22:39:23.484293 IP 134.122.35.219.ssh > bras-base-toroon0560w-grc-34-76-64-134-8.dsl.bell.ca.62923: Flags [P.], seq 1062840:1063044, ack 613, win 501, length 204
22:39:23.484419 IP 134.122.35.219.ssh > bras-base-toroon0560w-grc-34-76-64-134-8.dsl.bell.ca.62923: Flags [P.], seq 1063044:1063248, ack 613, win 501, length 204
22:39:23.484548 IP 134.122.35.219.ssh > bras-base-toroon0560w-grc-34-76-64-134-8.dsl.bell.ca.62923: Flags [P.], seq 1063248:1063452, ack 613, win 501, length 204
22:39:23.484695 IP 134.122.35.219.ssh > bras-base-toroon0560w-grc-34-76-64-134-8.dsl.bell.ca.62923: Flags [P.], seq 1063452:1063656, ack 613, win 501, length 204
22:39:23.484824 IP 134.122.35.219.ssh > bras-base-toroon0560w-grc-34-76-64-134-8.dsl.bell.ca.62923: Flags [P.], seq 1063656:1063860, ack 613, win 501, length 204
22:39:23.484951 IP 134.122.35.219.ssh > bras-base-toroon0560w-grc-34-76-64-134-8.dsl.bell.ca.62923: Flags [P.], seq 1063860:1064064, ack 613, win 501, length 204
22:39:23.485086 IP 134.122.35.219.ssh > bras-base-toroon0560w-grc-34-76-64-134-8.dsl.bell.ca.62923: Flags [P.], seq 1064064:1064268, ack 613, win 501, length 204
22:39:23.485249 IP 134.122.35.219.ssh > bras-base-toroon0560w-grc-34-76-64-134-8.dsl.bell.ca.62923: Flags [P.], seq 1064268:1064472, ack 613, win 501, length 204
22:39:23.485381 IP 134.122.35.219.ssh > bras-base-toroon0560w-grc-34-76-64-134-8.dsl.bell.ca.62923: Flags [P.], seq 1064472:1064676, ack 613, win 501, length 204
22:39:23.485506 IP 134.122.35.219.ssh > bras-base-toroon0560w-grc-34-76-64-134-8.dsl.bell.ca.62923: Flags [P.], seq 1064676:1064880, ack 613, win 501, length 204
22:39:23.485634 IP 134.122.35.219.ssh > bras-base-toroon0560w-grc-34-76-64-134-8.dsl.bell.ca.62923: Flags [P.], seq 1064880:1065084, ack 613, win 501, length 204
22:39:23.485760 IP 134.122.35.219.ssh > bras-base-toroon0560w-grc-34-76-64-134-8.dsl.bell.ca.62923: Flags [P.], seq 1065084:1065288, ack 613, win 501, length 204
22:39:23.485786 IP bras-base-toroon0560w-grc-34-76-64-134-8.dsl.bell.ca.62923 > 134.122.35.219.ssh: Flags [.], ack 1053984, win 1039, length 0
22:39:23.485796 IP bras-base-toroon0560w-grc-34-76-64-134-8.dsl.bell.ca.62923 > 134.122.35.219.ssh: Flags [P.], seq 613:649, ack 1053984, win 1039, length 36
22:39:23.485810 IP bras-base-toroon0560w-grc-34-76-64-134-8.dsl.bell.ca.62923 > 134.122.35.219.ssh: Flags [.], ack 1058676, win 1043, length 0
