root@lamp-ubuntu-s-1vcpu-1gb-tor1-01:~# tcpdump -c 5 -i eth0
tcpdump: verbose output suppressed, use -v or -vv for full protocol decode
listening on eth0, link-type EN10MB (Ethernet), capture size 262144 bytes
22:25:24.616078 IP 134.122.35.219.ssh > bras-base-toroon0560w-grc-34-76-64-134-8.dsl.bell.ca.62923: Flags [P.], seq 1447583997:1447584105, ack 646436657, win 501, length 108
22:25:24.616192 IP 134.122.35.219.ssh > bras-base-toroon0560w-grc-34-76-64-134-8.dsl.bell.ca.62923: Flags [P.], seq 108:144, ack 1, win 501, length 36
22:25:24.616298 IP 134.122.35.219.ssh > bras-base-toroon0560w-grc-34-76-64-134-8.dsl.bell.ca.62923: Flags [P.], seq 144:252, ack 1, win 501, length 108
22:25:24.616381 IP 134.122.35.219.ssh > bras-base-toroon0560w-grc-34-76-64-134-8.dsl.bell.ca.62923: Flags [P.], seq 252:288, ack 1, win 501, length 36
22:25:24.617055 IP 134.122.35.219.45734 > dns.google.domain: 65168+ PTR? 8.134.64.76.in-addr.arpa. (42)
5 packets captured
22 packets received by filter
0 packets dropped by kernel
