22:38:26.283654 IP 134.122.35.219.22 > 76.64.134.8.62923: Flags [P.], seq 955712:955868, ack 541, win 501, length 156
22:38:26.283805 IP 76.64.134.8.62923 > 134.122.35.219.22: Flags [.], ack 952096, win 515, length 0
22:38:26.283829 IP 76.64.134.8.62923 > 134.122.35.219.22: Flags [.], ack 952720, win 513, length 0
22:38:26.284036 IP 134.122.35.219.22 > 76.64.134.8.62923: Flags [P.], seq 955868:956224, ack 541, win 501, length 356
22:38:26.284207 IP 134.122.35.219.22 > 76.64.134.8.62923: Flags [P.], seq 956224:956380, ack 541, win 501, length 156
22:38:26.284344 IP 134.122.35.219.22 > 76.64.134.8.62923: Flags [P.], seq 956380:956536, ack 541, win 501, length 156
22:38:26.284476 IP 134.122.35.219.22 > 76.64.134.8.62923: Flags [P.], seq 956536:956692, ack 541, win 501, length 156
22:38:26.284731 IP 134.122.35.219.22 > 76.64.134.8.62923: Flags [P.], seq 956692:956848, ack 541, win 501, length 156
22:38:26.284869 IP 134.122.35.219.22 > 76.64.134.8.62923: Flags [P.], seq 956848:957004, ack 541, win 501, length 156
22:38:26.285002 IP 134.122.35.219.22 > 76.64.134.8.62923: Flags [P.], seq 957004:957160, ack 541, win 501, length 156
22:38:26.285138 IP 134.122.35.219.22 > 76.64.134.8.62923: Flags [P.], seq 957160:957316, ack 541, win 501, length 156
22:38:26.285269 IP 134.122.35.219.22 > 76.64.134.8.62923: Flags [P.], seq 957316:957472, ack 541, win 501, length 156
22:38:26.285398 IP 134.122.35.219.22 > 76.64.134.8.62923: Flags [P.], seq 957472:957628, ack 541, win 501, length 156
22:38:26.285533 IP 134.122.35.219.22 > 76.64.134.8.62923: Flags [P.], seq 957628:957784, ack 541, win 501, length 156
22:38:26.285658 IP 134.122.35.219.22 > 76.64.134.8.62923: Flags [P.], seq 957784:957940, ack 541, win 501, length 156
22:38:26.285789 IP 134.122.35.219.22 > 76.64.134.8.62923: Flags [P.], seq 957940:958096, ack 541, win 501, length 156
22:38:26.285922 IP 134.122.35.219.22 > 76.64.134.8.62923: Flags [P.], seq 958096:958252, ack 541, win 501, length 156
22:38:26.286047 IP 134.122.35.219.22 > 76.64.134.8.62923: Flags [P.], seq 958252:958408, ack 541, win 501, length 156
22:38:26.286172 IP 134.122.35.219.22 > 76.64.134.8.62923: Flags [P.], seq 958408:958564, ack 541, win 501, length 156
22:38:26.286298 IP 134.122.35.219.22 > 76.64.134.8.62923: Flags [P.], seq 958564:958720, ack 541, win 501, length 156
22:38:26.286430 IP 134.122.35.219.22 > 76.64.134.8.62923: Flags [P.], seq 958720:958876, ack 541, win 501, length 156
22:38:26.286554 IP 134.122.35.219.22 > 76.64.134.8.62923: Flags [P.], seq 958876:959032, ack 541, win 501, length 156
22:38:26.286784 IP 134.122.35.219.22 > 76.64.134.8.62923: Flags [P.], seq 959032:959188, ack 541, win 501, length 156
22:38:26.286956 IP 134.122.35.219.22 > 76.64.134.8.62923: Flags [P.], seq 959188:959344, ack 541, win 501, length 156
22:38:26.287122 IP 134.122.35.219.22 > 76.64.134.8.62923: Flags [P.], seq 959344:959500, ack 541, win 501, length 156
22:38:26.287255 IP 134.122.35.219.22 > 76.64.134.8.62923: Flags [P.], seq 959500:959656, ack 541, win 501, length 156
22:38:26.287385 IP 134.122.35.219.22 > 76.64.134.8.62923: Flags [P.], seq 959656:959812, ack 541, win 501, length 156
22:38:26.287514 IP 134.122.35.219.22 > 76.64.134.8.62923: Flags [P.], seq 959812:959968, ack 541, win 501, length 156
22:38:26.287654 IP 134.122.35.219.22 > 76.64.134.8.62923: Flags [P.], seq 959968:960124, ack 541, win 501, length 156
22:38:26.287883 IP 134.122.35.219.22 > 76.64.134.8.62923: Flags [P.], seq 960124:960280, ack 541, win 501, length 156
22:38:26.288072 IP 134.122.35.219.22 > 76.64.134.8.62923: Flags [P.], seq 960280:960436, ack 541, win 501, length 156
22:38:26.288213 IP 134.122.35.219.22 > 76.64.134.8.62923: Flags [P.], seq 960436:960592, ack 541, win 501, length 156
22:38:26.288346 IP 134.122.35.219.22 > 76.64.134.8.62923: Flags [P.], seq 960592:960748, ack 541, win 501, length 156
22:38:26.288477 IP 134.122.35.219.22 > 76.64.134.8.62923: Flags [P.], seq 960748:960904, ack 541, win 501, length 156
22:38:26.288604 IP 134.122.35.219.22 > 76.64.134.8.62923: Flags [P.], seq 960904:961060, ack 541, win 501, length 156
22:38:26.288733 IP 134.122.35.219.22 > 76.64.134.8.62923: Flags [P.], seq 961060:961216, ack 541, win 501, length 156
22:38:26.288865 IP 134.122.35.219.22 > 76.64.134.8.62923: Flags [P.], seq 961216:961372, ack 541, win 501, length 156
22:38:26.288994 IP 134.122.35.219.22 > 76.64.134.8.62923: Flags [P.], seq 961372:961528, ack 541, win 501, length 156
22:38:26.289120 IP 134.122.35.219.22 > 76.64.134.8.62923: Flags [P.], seq 961528:961684, ack 541, win 501, length 156
22:38:26.289246 IP 134.122.35.219.22 > 76.64.134.8.62923: Flags [P.], seq 961684:961840, ack 541, win 501, length 156
22:38:26.289378 IP 134.122.35.219.22 > 76.64.134.8.62923: Flags [P.], seq 961840:961996, ack 541, win 501, length 156
22:38:26.289506 IP 134.122.35.219.22 > 76.64.134.8.62923: Flags [P.], seq 961996:962152, ack 541, win 501, length 156
22:38:26.289633 IP 134.122.35.219.22 > 76.64.134.8.62923: Flags [P.], seq 962152:962308, ack 541, win 501, length 156
22:38:26.289761 IP 134.122.35.219.22 > 76.64.134.8.62923: Flags [P.], seq 962308:962464, ack 541, win 501, length 156
22:38:26.289896 IP 134.122.35.219.22 > 76.64.134.8.62923: Flags [P.], seq 962464:962620, ack 541, win 501, length 156
22:38:26.290030 IP 134.122.35.219.22 > 76.64.134.8.62923: Flags [P.], seq 962620:962776, ack 541, win 501, length 156
22:38:26.290155 IP 134.122.35.219.22 > 76.64.134.8.62923: Flags [P.], seq 962776:962932, ack 541, win 501, length 156
22:38:26.290280 IP 134.122.35.219.22 > 76.64.134.8.62923: Flags [P.], seq 962932:963088, ack 541, win 501, length 156
22:38:26.290416 IP 134.122.35.219.22 > 76.64.134.8.62923: Flags [P.], seq 963088:963244, ack 541, win 501, length 156
22:38:26.290542 IP 134.122.35.219.22 > 76.64.134.8.62923: Flags [P.], seq 963244:963400, ack 541, win 501, length 156
22:38:26.290672 IP 134.122.35.219.22 > 76.64.134.8.62923: Flags [P.], seq 963400:963556, ack 541, win 501, length 156
22:38:26.290801 IP 134.122.35.219.22 > 76.64.134.8.62923: Flags [P.], seq 963556:963712, ack 541, win 501, length 156
22:38:26.290964 IP 134.122.35.219.22 > 76.64.134.8.62923: Flags [P.], seq 963712:963868, ack 541, win 501, length 156
22:38:26.291137 IP 134.122.35.219.22 > 76.64.134.8.62923: Flags [P.], seq 963868:964024, ack 541, win 501, length 156
22:38:26.291267 IP 134.122.35.219.22 > 76.64.134.8.62923: Flags [P.], seq 964024:964180, ack 541, win 501, length 156
22:38:26.291409 IP 134.122.35.219.22 > 76.64.134.8.62923: Flags [P.], seq 964180:964336, ack 541, win 501, length 156
22:38:26.291557 IP 134.122.35.219.22 > 76.64.134.8.62923: Flags [P.], seq 964336:964492, ack 541, win 501, length 156
22:38:26.291798 IP 76.64.134.8.62923 > 134.122.35.219.22: Flags [.], ack 955712, win 516, length 0
22:38:26.291815 IP 76.64.134.8.62923 > 134.122.35.219.22: Flags [.], ack 959188, win 516, length 0
22:38:26.291822 IP 134.122.35.219.22 > 76.64.134.8.62923: Flags [P.], seq 964492:964648, ack 541, win 501, length 156
22:38:26.292015 IP 134.122.35.219.22 > 76.64.134.8.62923: Flags [P.], seq 964648:965004, ack 541, win 501, length 356
22:38:26.292253 IP 134.122.35.219.22 > 76.64.134.8.62923: Flags [P.], seq 965004:965160, ack 541, win 501, length 156
22:38:26.292388 IP 134.122.35.219.22 > 76.64.134.8.62923: Flags [P.], seq 965160:965316, ack 541, win 501, length 156
22:38:26.292528 IP 134.122.35.219.22 > 76.64.134.8.62923: Flags [P.], seq 965316:965472, ack 541, win 501, length 156
22:38:26.292652 IP 134.122.35.219.22 > 76.64.134.8.62923: Flags [P.], seq 965472:965628, ack 541, win 501, length 156
22:38:26.292777 IP 134.122.35.219.22 > 76.64.134.8.62923: Flags [P.], seq 965628:965784, ack 541, win 501, length 156
22:38:26.292899 IP 134.122.35.219.22 > 76.64.134.8.62923: Flags [P.], seq 965784:965940, ack 541, win 501, length 156
22:38:26.293029 IP 134.122.35.219.22 > 76.64.134.8.62923: Flags [P.], seq 965940:966096, ack 541, win 501, length 156
22:38:26.293157 IP 134.122.35.219.22 > 76.64.134.8.62923: Flags [P.], seq 966096:966252, ack 541, win 501, length 156
22:38:26.293283 IP 134.122.35.219.22 > 76.64.134.8.62923: Flags [P.], seq 966252:966408, ack 541, win 501, length 156
22:38:26.293408 IP 134.122.35.219.22 > 76.64.134.8.62923: Flags [P.], seq 966408:966564, ack 541, win 501, length 156
22:38:26.293538 IP 134.122.35.219.22 > 76.64.134.8.62923: Flags [P.], seq 966564:966720, ack 541, win 501, length 156
22:38:26.293675 IP 134.122.35.219.22 > 76.64.134.8.62923: Flags [P.], seq 966720:966876, ack 541, win 501, length 156
22:38:26.293812 IP 76.64.134.8.62923 > 134.122.35.219.22: Flags [.], ack 963088, win 516, length 0
22:38:26.293835 IP 134.122.35.219.22 > 76.64.134.8.62923: Flags [P.], seq 966876:967032, ack 541, win 501, length 156
22:38:26.293994 IP 134.122.35.219.22 > 76.64.134.8.62923: Flags [P.], seq 967032:967292, ack 541, win 501, length 260
22:38:26.294131 IP 134.122.35.219.22 > 76.64.134.8.62923: Flags [P.], seq 967292:967448, ack 541, win 501, length 156
22:38:26.294264 IP 134.122.35.219.22 > 76.64.134.8.62923: Flags [P.], seq 967448:967604, ack 541, win 501, length 156
22:38:26.294390 IP 134.122.35.219.22 > 76.64.134.8.62923: Flags [P.], seq 967604:967760, ack 541, win 501, length 156
22:38:26.294521 IP 134.122.35.219.22 > 76.64.134.8.62923: Flags [P.], seq 967760:967916, ack 541, win 501, length 156
22:38:26.294648 IP 134.122.35.219.22 > 76.64.134.8.62923: Flags [P.], seq 967916:968072, ack 541, win 501, length 156
22:38:26.294778 IP 134.122.35.219.22 > 76.64.134.8.62923: Flags [P.], seq 968072:968228, ack 541, win 501, length 156
22:38:26.294813 IP 76.64.134.8.62923 > 134.122.35.219.22: Flags [P.], seq 541:577, ack 963088, win 516, length 36
22:38:26.294850 IP 76.64.134.8.62923 > 134.122.35.219.22: Flags [.], ack 964648, win 516, length 0
22:38:26.294858 IP 76.64.134.8.62923 > 134.122.35.219.22: Flags [.], ack 965316, win 513, length 0
^C
6541 packets captured
6541 packets received by filter
0 packets dropped by kernel

